### ISSUE TITLE
Connection drops when enabling Version 2 (ASPA + ROA) on Huawei NetEngine8000

### ISSUE THREAD

**Issue by Aldin981403** [bgp/stayrtr#168]
I have been testing this tool with a Huawei NetEngine8000 F1A and encountered an issue when switching to "version 2" to enable support for both ASPA and ROA.

Environment Details:

Hardware: Huawei NetEngine8000 F1A

Software Version: V800R024C00SPC500

Patch: V800R024SPH122

Issue Description:
While the connection works perfectly on the previous version, it drops immediately upon switching to version 2. There are no specific error messages or logs provided, other than the standard TCP connection cycle:

accept tcp connect .....

disconnect tcp ...

Has anyone encountered this behavior or knows of a workaround/fix for this?

**Comment by benjojo** [comment]
Could you provide a pcap of this behaviour so we can debug this?

If you do not want to share it on the mailing list you can email it to 
***@***.*** and I can have a look

**Comment by Aldin981403** [comment]
To help you better understand the setup, here is the current network structure:
A Virtual Machine running StayRTR is connected via Wi-Fi to a MikroTik router (acting transparently). The MikroTik is then connected via Ethernet directly to the Huawei F1A router.

I have attached the packet capture with version 2 (ASPA) enabled. I am only sharing the first instance of the capture, as the following attempts are exact copies that keep repeating every 40 seconds or so.


**Packet Capture (Filtered for ASPA version 2 enabled):**

Capturing on 'any'
  102 8.629345708 10.20.30.100 → 10.20.30.239 TCP 62 55259 → 3323 [SYN] Seq=0 Win=61440 Len=0 MSS=1460
  103 8.629387790 10.20.30.239 → 10.20.30.100 TCP 60 3323 → 55259 [SYN, ACK] Seq=0 Ack=1 Win=64240 Len=0 MSS=1460
  104 8.632356837 10.20.30.100 → 10.20.30.239 TCP 62 55259 → 3323 [ACK] Seq=1 Ack=1 Win=61440 Len=0
  105 8.633293709 10.20.30.100 → 10.20.30.239 TCP 64 55259 → 3323 [PSH, ACK] Seq=1 Ack=1 Win=61440 Len=8
  106 8.633320399 10.20.30.239 → 10.20.30.100 TCP 56 3323 → 55259 [ACK] Seq=1 Ack=9 Win=64232 Len=0
  107 8.633655997 10.20.30.239 → 10.20.30.100 TCP 93 3323 → 55259 [PSH, ACK] Seq=1 Ack=9 Win=64232 Len=37
  108 8.634053069 10.20.30.239 → 10.20.30.100 TCP 56 3323 → 55259 [FIN, ACK] Seq=38 Ack=9 Win=64232 Len=0
  109 8.636405049 10.20.30.100 → 10.20.30.239 TCP 64 55259 → 3323 [PSH, ACK] Seq=9 Ack=38 Win=61440 Len=8
  110 8.636405427 10.20.30.100 → 10.20.30.239 TCP 62 55259 → 3323 [ACK] Seq=17 Ack=39 Win=61440 Len=0
  111 8.636443122 10.20.30.239 → 10.20.30.100 TCP 56 3323 → 55259 [RST] Seq=38 Win=0 Len=0
  112 8.636561148 10.20.30.239 → 10.20.30.100 TCP 56 3323 → 55259 [RST] Seq=39 Win=0 Len=0
  113 8.637586751 10.20.30.100 → 10.20.30.239 TCP 62 55259 → 3323 [FIN, ACK] Seq=17 Ack=39 Win=61440 Len=0
  114 8.637599180 10.20.30.239 → 10.20.30.100 TCP 56 3323 → 55259 [RST] Seq=39 Win=0 Len=0




I also add other information that might be useful
root@ubuntu2204:/home/ubuntu# sudo systemctl status rpki-client
● rpki-client.service - OpenBSD RPKI validator
     Loaded: loaded (/usr/lib/systemd/system/rpki-client.service; static)
     Active: activating (start) since Wed 2026-04-08 12:05:42 CEST; 5min ago
TriggeredBy: ● rpki-client.timer
       Docs: man:rpki-client(8)
   Main PID: 4517 (rpki-client)
      Tasks: 5 (limit: 10583)
     Memory: 1.0G (peak: 1.0G)
        CPU: 5min 31.647s
     CGroup: /system.slice/rpki-client.service
             ├─4517 /usr/sbin/rpki-client
             ├─4518 /usr/sbin/rpki-client
             ├─4519 /usr/sbin/rpki-client
             ├─4520 /usr/sbin/rpki-client
             └─4521 /usr/sbin/rpki-client

Apr 08 12:10:13 ubuntu2204 rpki-client[4518]: rpki-client: rsync.paas.rpki.ripe.net/repository/ebf04c7c-f82d-471d-85ad-98c65de1c912/0/B3B9360C0DDA3D688F4DBE53E2B6D3CEF47FE825.mft: CRL has expired
Apr 08 12:10:15 ubuntu2204 rpki-client[4518]: rpki-client: rsync.paas.rpki.ripe.net/repository/9566443b-dff4-4d13-bb81-72c8630d6df6/0/FF4F0B358CBD6C54ECCBEBF26F6D1A05F1D537E8.mft: CRL has expired
Apr 08 12:10:17 ubuntu2204 rpki-client[4518]: rpki-client: rsync.paas.rpki.ripe.net/repository/32bfd357-d83b-400a-8c46-4fbd1119f4a3/2/C5557C97D7BBFF47CA22AD5FB9F0589FAAF159BD.mft: no valid manifest available
Apr 08 12:10:18 ubuntu2204 rpki-client[4518]: rpki-client: rsync.paas.rpki.ripe.net/repository/137bbed0-a12b-417b-a973-567f41a320d1/0/6F8A258586E22F8D1942882B7F8B9C2CE885D805.mft: CRL has expired
Apr 08 12:10:19 ubuntu2204 rpki-client[4518]: rpki-client: rsync.paas.rpki.ripe.net/repository/1bd306b4-e5c3-48f9-b2ee-36a9bdded8c4/1/25BB542055398CAC21DB2407FD8E7D795A10F5ED.mft: CRL has expired
Apr 08 12:10:21 ubuntu2204 rpki-client[4518]: rpki-client: rsync.paas.rpki.ripe.net/repository/d08bc49d-0338-4b5f-8204-0004a66105c9/0/5511F6D7DEF4C0FFB6E2B3B3F0C4455DCD14C160.mft: CRL has expired
Apr 08 12:10:21 ubuntu2204 rpki-client[4518]: rpki-client: rpki-rsync.us-east-2.amazonaws.com/volume/967a255c-d680-42d3-9ec3-ecb3f9da088c/_lAi5THDsQdPYA9nmET6olHuVc8.mft: no valid manifest available
Apr 08 12:10:23 ubuntu2204 rpki-client[4518]: rpki-client: rsync.paas.rpki.ripe.net/repository/fa1b8677-ea6b-4043-907d-59f4675f2977/0/C3A70AD7F32685733597C663E02CE28A3306F923.mft: CRL has expired
Apr 08 12:10:24 ubuntu2204 rpki-client[4518]: rpki-client: rsync.paas.rpki.ripe.net/repository/1138842c-2919-4ca2-9501-e9aaeb6a29f5/0/0B79AD21B8CADBA7A18A49F28BBB52B772404034.mft: CRL has expired
Apr 08 12:10:25 ubuntu2204 rpki-client[4518]: rpki-client: rpki-rps.arin.net/repository/821eef7e060345e4be569cd347ccbe36/2/C1DC25C780E7A24817139D980A28A9781FA6A493.mft: CRL has expired
root@ubuntu2204:/home/ubuntu# 

● stayrtr.service - StayRTR RPKI/ASPA Cache Server Compatibility Mode
     Loaded: loaded (/etc/systemd/system/stayrtr.service; enabled; preset: enabled)
     Active: active (running) since Wed 2026-04-08 11:29:39 CEST; 42min ago
   Main PID: 1557 (stayrtr)
      Tasks: 10 (limit: 10583)
     Memory: 693.0M (peak: 1.0G)
        CPU: 2min 18.926s
     CGroup: /system.slice/stayrtr.service
             └─1557 /usr/bin/stayrtr -cache /var/lib/rpki-client/json -bind :3323

Apr 08 12:09:58 ubuntu2204 stayrtr[1557]: time="2026-04-08T12:09:58+02:00" level=info msg="New update to old state (811257 uniques, 811259 total prefixes). (old 811281 - new 811259)"
Apr 08 12:10:02 ubuntu2204 stayrtr[1557]: time="2026-04-08T12:10:02+02:00" level=info msg="Update added, new serial 3"
Apr 08 12:10:12 ubuntu2204 stayrtr[1557]: time="2026-04-08T12:10:12+02:00" level=info msg="Accepted tcp connection from 10.20.30.100:58534 (2/0)"
Apr 08 12:10:12 ubuntu2204 stayrtr[1557]: time="2026-04-08T12:10:12+02:00" level=info msg="Disconnecting client 10.20.30.100:58534 (v0) / Serial: 0"
Apr 08 12:10:39 ubuntu2204 stayrtr[1557]: time="2026-04-08T12:10:39+02:00" level=info msg="Accepted tcp connection from 10.20.30.100:58992 (2/0)"
Apr 08 12:10:39 ubuntu2204 stayrtr[1557]: time="2026-04-08T12:10:39+02:00" level=info msg="Disconnecting client 10.20.30.100:58992 (v0) / Serial: 0"
Apr 08 12:11:09 ubuntu2204 stayrtr[1557]: time="2026-04-08T12:11:09+02:00" level=info msg="Accepted tcp connection from 10.20.30.100:59330 (2/0)"
Apr 08 12:11:09 ubuntu2204 stayrtr[1557]: time="2026-04-08T12:11:09+02:00" level=info msg="Disconnecting client 10.20.30.100:59330 (v0) / Serial: 0"
Apr 08 12:11:36 ubuntu2204 stayrtr[1557]: time="2026-04-08T12:11:36+02:00" level=info msg="Accepted tcp connection from 10.20.30.100:49760 (2/0)"
Apr 08 12:11:36 ubuntu2204 stayrtr[1557]: time="2026-04-08T12:11:36+02:00" level=info msg="Disconnecting client 10.20.30.100:49760 (v0) / Serial: 0"




LOG
root@ubuntu2204:/home/ubuntu# sudo journalctl -u stayrtr -f
Apr 08 12:10:12 ubuntu2204 stayrtr[1557]: time="2026-04-08T12:10:12+02:00" level=info msg="Accepted tcp connection from 10.20.30.100:58534 (2/0)"
Apr 08 12:10:12 ubuntu2204 stayrtr[1557]: time="2026-04-08T12:10:12+02:00" level=info msg="Disconnecting client 10.20.30.100:58534 (v0) / Serial: 0"
Apr 08 12:10:39 ubuntu2204 stayrtr[1557]: time="2026-04-08T12:10:39+02:00" level=info msg="Accepted tcp connection from 10.20.30.100:58992 (2/0)"
Apr 08 12:10:39 ubuntu2204 stayrtr[1557]: time="2026-04-08T12:10:39+02:00" level=info msg="Disconnecting client 10.20.30.100:58992 (v0) / Serial: 0"
Apr 08 12:11:09 ubuntu2204 stayrtr[1557]: time="2026-04-08T12:11:09+02:00" level=info msg="Accepted tcp connection from 10.20.30.100:59330 (2/0)"
Apr 08 12:11:09 ubuntu2204 stayrtr[1557]: time="2026-04-08T12:11:09+02:00" level=info msg="Disconnecting client 10.20.30.100:59330 (v0) / Serial: 0"
Apr 08 12:11:36 ubuntu2204 stayrtr[1557]: time="2026-04-08T12:11:36+02:00" level=info msg="Accepted tcp connection from 10.20.30.100:49760 (2/0)"
Apr 08 12:11:36 ubuntu2204 stayrtr[1557]: time="2026-04-08T12:11:36+02:00" level=info msg="Disconnecting client 10.20.30.100:49760 (v0) / Serial: 0"
Apr 08 12:12:06 ubuntu2204 stayrtr[1557]: time="2026-04-08T12:12:06+02:00" level=info msg="Accepted tcp connection from 10.20.30.100:61442 (2/0)"
Apr 08 12:12:06 ubuntu2204 stayrtr[1557]: time="2026-04-08T12:12:06+02:00" level=info msg="Disconnecting client 10.20.30.100:61442 (v0) / Serial: 0"
Apr 08 12:12:33 ubuntu2204 stayrtr[1557]: time="2026-04-08T12:12:33+02:00" level=info msg="Accepted tcp connection from 10.20.30.100:56565 (2/0)"
Apr 08 12:12:33 ubuntu2204 stayrtr[1557]: time="2026-04-08T12:12:33+02:00" level=info msg="Disconnecting client 10.20.30.100:56565 (v0) / Serial: 0"

**Comment by benjojo** [comment]
Can you make sure you are running the latest version? It should be v0.6.4

**Comment by Aldin981403** [comment]
yes I use the latest version

root@ubuntu2204:/home/ubuntu# stayrtr -version
StayRTR 0.6.4

**Comment by lukastribus** [comment]
Duplicate of #165 ?

**Comment by Aldin981403** [comment]
I read, and the problem seems to be that, but Huawei F1A routers have access to version 2 (they are professional routers, from the manual they are compliant with the use of V2)

**Comment by lukastribus** [comment]
Huawei supports RTRv2.
StayRTR does not.

Because StayRTR is not yet properly handling unsupported RTR version - like RTRv2 - the connections drops instead of negotiating down to version 1.

**Comment by job** [comment]
@Aldin981403 can you test this pull request? https://github.com/bgp/stayrtr/pull/167

```
$ git clone https://github.com/bgp/stayrtr
$ cd stayrtr
$ git fetch origin pull/167/head:fix_version_neg
$ git checkout fix_version_neg
$ make build-stayrtr
```

You then should end up with a binary with a fix for version negotiation:

```
$ ./dist/stayrtr-v0.6.4-1-g9499860-linux-x86_64 -version
StayRTR 0.6.4
```

**Comment by job** [comment]
@Aldin981403 your testing of potential bugfix en would be greatly appreciated

**Comment by Aldin981403** [comment]
Hi! I tested this and ran the commands you suggested. 
As soon as I can turn on the routers I'll send you all the data (sorry for the wait but I wasn't in the office these days)
The build was successful. Here is the output:

```bash
From [https://github.com/bgp/stayrtr](https://github.com/bgp/stayrtr)
 * [new ref]         refs/pull/167/head -> fix_version_neg
Switched to branch 'fix_version_neg'
mkdir -p dist/
go build -trimpath -ldflags '-X main.version=v0.6.4-1-g9499860 -X main.buildinfos=(2026-04-13T09:48:17+0200)' -o dist/stayrtr-v0.6.4-1-g9499860-linux-x86_64 cmd/stayrtr/stayrtr.go
go: downloading go1.24.3 (linux/amd64)
go: downloading [github.com/prometheus/client_golang](https://github.com/prometheus/client_golang) v1.21.1
go: downloading golang.org/x/crypto v0.45.0
go: downloading [github.com/sirupsen/logrus](https://github.com/sirupsen/logrus) v1.9.3
go: downloading golang.org/x/sync v0.18.0
go: downloading golang.org/x/sys v0.38.0
go: downloading [github.com/klauspost/compress](https://github.com/klauspost/compress) v1.17.11
go: downloading [github.com/prometheus/client_model](https://github.com/prometheus/client_model) v0.6.1
go: downloading [github.com/prometheus/common](https://github.com/prometheus/common) v0.62.0
go: downloading [github.com/beorn7/perks](https://github.com/beorn7/perks) v1.0.1
go: downloading [github.com/cespare/xxhash/v2](https://github.com/cespare/xxhash/v2) v2.3.0
go: downloading [github.com/prometheus/procfs](https://github.com/prometheus/procfs) v0.15.1
go: downloading google.golang.org/protobuf v1.36.5
go: downloading [github.com/munnerz/goautoneg](https://github.com/munnerz/goautoneg) v0.0.0-20191010083416-a7dc8b61c822
StayRTR 0.6.4
root@ubuntu2204:/home/ubuntu/stayrtr#

**Comment by job** [comment]
And the connection is no longer dropping every 40 seconds?

**Comment by Aldin981403** [comment]
Now the connection doesn't flap anymore. But I haven't entered the ASPAs yet. To avoid making mistakes, could you recommend a command to enter them correctly?

**Comment by job** [comment]
The version you are testing does not support ASPA yet, the bugfix is merely to ensure there is no flapping in backwards compatibility situations. Your debugging was very helpful.

ASPA discussion can continue in https://github.com/bgp/stayrtr/pull/156

**Comment by Aldin981403** [comment]
Thank you very much, then I confirm that, for Hauwei, and without aspa installed, both with version 0 and version 2 the ROA increases without any type of FLAP and the connection occurs in a clean and efficient way
